[
  {
    "id": "tyranid-warriors-with-ranged-bio-weapons-wgo-mfm-1",
    "unit_id": "tyranid-warriors-with-ranged-bio-weapons",
    "faction_id": "tyranids",
    "game_version": {
      "edition": "11th",
      "dataslate": "launch"
    },
    "is_free": true,
    "replaces": [
      "devourer"
    ],
    "replacement_choice": [
      [
        "venom-cannon"
      ],
      [
        "barbed-strangler"
      ],
      [
        "spinefists"
      ],
      [
        "deathspitter"
      ]
    ],
    "model_constraint": {
      "model_name": "Tyranid Prime",
      "any_number": true
    }
  },
  {
    "id": "tyranid-warriors-with-ranged-bio-weapons-wgo-mfm-2",
    "unit_id": "tyranid-warriors-with-ranged-bio-weapons",
    "faction_id": "tyranids",
    "game_version": {
      "edition": "11th",
      "dataslate": "launch"
    },
    "is_free": true,
    "replaces": [
      "devourer"
    ],
    "replacement_choice": [
      [
        "barbed-strangler"
      ],
      [
        "venom-cannon"
      ],
      [
        "spinefists"
      ],
      [
        "deathspitter"
      ]
    ],
    "model_constraint": {
      "model_name": "Tyranid Warrior",
      "any_number": true
    }
  },
  {
    "id": "winged-hive-tyrant-wgo-mfm-1",
    "unit_id": "winged-hive-tyrant",
    "faction_id": "tyranids",
    "game_version": {
      "edition": "11th",
      "dataslate": "launch"
    },
    "is_free": true,
    "replaces": [
      "monstrous-bonesword-and-lash-whip"
    ],
    "replacement_choice": [
      [
        "monstrous-scything-talons"
      ],
      [
        "stranglethorn-cannon"
      ],
      [
        "heavy-venom-cannon"
      ]
    ],
    "model_constraint": {
      "any_number": true
    }
  },
  {
    "id": "ripper-swarms-wgo-mfm-1",
    "unit_id": "ripper-swarms",
    "faction_id": "tyranids",
    "game_version": {
      "edition": "11th",
      "dataslate": "launch"
    },
    "is_free": true,
    "replacement": [
      "spinemaws"
    ],
    "model_constraint": {
      "any_number": true
    }
  },
  {
    "id": "tyrannofex-wgo-mfm-1",
    "unit_id": "tyrannofex",
    "faction_id": "tyranids",
    "game_version": {
      "edition": "11th",
      "dataslate": "launch"
    },
    "is_free": true,
    "replaces": [
      "fleshborer-hive"
    ],
    "replacement_choice": [
      [
        "rupture-cannon"
      ],
      [
        "acid-spray"
      ]
    ],
    "model_constraint": {
      "any_number": true
    }
  },
  {
    "id": "harpy-wgo-mfm-1",
    "unit_id": "harpy",
    "faction_id": "tyranids",
    "game_version": {
      "edition": "11th",
      "dataslate": "launch"
    },
    "is_free": true,
    "replaces": [
      "twin-stranglethorn-cannon"
    ],
    "replacement": [
      "twin-heavy-venom-cannon"
    ],
    "model_constraint": {
      "any_number": true
    }
  },
  {
    "id": "tyrant-guard-wgo-mfm-1",
    "unit_id": "tyrant-guard",
    "faction_id": "tyranids",
    "game_version": {
      "edition": "11th",
      "dataslate": "launch"
    },
    "is_free": true,
    "replaces": [
      "scything-talons-and-rending-claws"
    ],
    "replacement_choice": [
      [
        "bone-cleaver-lash-whip-and-rending-claws"
      ],
      [
        "crushing-claws-and-rending-claws"
      ]
    ],
    "model_constraint": {
      "any_number": true
    }
  },
  {
    "id": "termagants-wgo-mfm-1",
    "unit_id": "termagants",
    "faction_id": "tyranids",
    "game_version": {
      "edition": "11th",
      "dataslate": "launch"
    },
    "is_free": true,
    "replaces": [
      "fleshborer"
    ],
    "replacement_choice": [
      [
        "strangleweb"
      ],
      [
        "shardlauncher"
      ],
      [
        "spike-rifle"
      ]
    ],
    "model_constraint": {
      "per_n_models": 10
    }
  },
  {
    "id": "termagants-wgo-mfm-2",
    "unit_id": "termagants",
    "faction_id": "tyranids",
    "game_version": {
      "edition": "11th",
      "dataslate": "launch"
    },
    "is_free": true,
    "replaces": [
      "fleshborer"
    ],
    "replacement_choice": [
      [
        "termagant-devourer"
      ],
      [
        "termagant-spinefists"
      ]
    ],
    "model_constraint": {
      "any_number": true
    }
  },
  {
    "id": "hive-guard-wgo-mfm-1",
    "unit_id": "hive-guard",
    "faction_id": "tyranids",
    "game_version": {
      "edition": "11th",
      "dataslate": "launch"
    },
    "is_free": true,
    "replaces": [
      "shockcannon"
    ],
    "replacement": [
      "impaler-cannon"
    ],
    "model_constraint": {
      "any_number": true
    }
  },
  {
    "id": "tervigon-wgo-mfm-1",
    "unit_id": "tervigon",
    "faction_id": "tyranids",
    "game_version": {
      "edition": "11th",
      "dataslate": "launch"
    },
    "is_free": true,
    "replaces": [
      "massive-scything-talons"
    ],
    "replacement": [
      "massive-crushing-claws"
    ],
    "model_constraint": {
      "any_number": true
    }
  },
  {
    "id": "carnifexes-wgo-bsd-1",
    "unit_id": "carnifexes",
    "faction_id": "tyranids",
    "game_version": {
      "edition": "11th",
      "dataslate": "launch"
    },
    "is_free": true,
    "replacement_choice": [
      [
        "carnifex-crushing-claws"
      ],
      [
        "deathspitters-with-slimer-maggots"
      ],
      [
        "devourers-with-brainleech-worms"
      ]
    ],
    "replaces": [
      "carnifex-scything-talons"
    ],
    "model_constraint": {
      "any_number": true
    }
  },
  {
    "id": "carnifexes-wgo-bsd-2",
    "unit_id": "carnifexes",
    "faction_id": "tyranids",
    "game_version": {
      "edition": "11th",
      "dataslate": "launch"
    },
    "is_free": true,
    "replacement_choice": [
      [
        "carnifex-crushing-claws"
      ],
      [
        "deathspitters-with-slimer-maggots"
      ],
      [
        "devourers-with-brainleech-worms"
      ],
      [
        "heavy-venom-cannon-carnifexes"
      ],
      [
        "stranglethorn-cannon-carnifexes"
      ]
    ],
    "replaces": [
      "carnifex-extra-scything-talons"
    ],
    "model_constraint": {
      "any_number": true
    }
  },
  {
    "id": "carnifexes-wgo-bsd-3",
    "unit_id": "carnifexes",
    "faction_id": "tyranids",
    "game_version": {
      "edition": "11th",
      "dataslate": "launch"
    },
    "is_free": true,
    "model_constraint": {
      "any_number": true
    },
    "replacement": [
      "bio-plasma"
    ]
  },
  {
    "id": "carnifexes-wgo-bsd-4",
    "unit_id": "carnifexes",
    "faction_id": "tyranids",
    "game_version": {
      "edition": "11th",
      "dataslate": "launch"
    },
    "is_free": true,
    "model_constraint": {
      "any_number": true
    },
    "replacement": [
      "spine-banks"
    ]
  },
  {
    "id": "hive-tyrant-wgo-mfm-1",
    "unit_id": "hive-tyrant",
    "faction_id": "tyranids",
    "game_version": {
      "edition": "11th",
      "dataslate": "launch"
    },
    "is_free": true,
    "replaces": [
      "monstrous-bonesword-and-lash-whip"
    ],
    "replacement_choice": [
      [
        "heavy-venom-cannon"
      ],
      [
        "stranglethorn-cannon"
      ],
      [
        "monstrous-scything-talons"
      ]
    ],
    "model_constraint": {
      "any_number": true
    }
  },
  {
    "id": "hive-tyrant-wgo-mfm-2",
    "unit_id": "hive-tyrant",
    "faction_id": "tyranids",
    "game_version": {
      "edition": "11th",
      "dataslate": "launch"
    },
    "is_free": true,
    "replaces": [
      "monstrous-scything-talons"
    ],
    "replacement_choice": [
      [
        "heavy-venom-cannon"
      ],
      [
        "stranglethorn-cannon"
      ]
    ],
    "model_constraint": {
      "any_number": true
    }
  }
]
