[
  {
    "id": "sentinel-sergeant-melee-swap",
    "unit_id": "ironclad-sentinels",
    "faction_id": "stellar-wardens",
    "model_constraint": {
      "model_name": "Sentinel Sergeant",
      "max_count": 1
    },
    "replaces": ["combat-blade"],
    "replacement": ["power-halberd"],
    "is_free": true,
    "game_version": { "edition": "10th", "dataslate": "2025-q3" }
  },
  {
    "id": "sentinel-heavy-weapon-swap",
    "unit_id": "ironclad-sentinels",
    "faction_id": "stellar-wardens",
    "model_constraint": {
      "per_n_models": 5,
      "max_count": 2
    },
    "replaces": ["bolt-carbine"],
    "replacement": ["stellar-lance"],
    "is_free": false,
    "additional_cost": 5,
    "game_version": { "edition": "10th", "dataslate": "2025-q3" }
  },
  {
    "id": "sentinel-icon-addon",
    "unit_id": "ironclad-sentinels",
    "faction_id": "stellar-wardens",
    "model_constraint": {
      "max_count": 1
    },
    "replacement": ["icon-of-the-example"],
    "is_free": true,
    "game_version": { "edition": "10th", "dataslate": "2025-q3" }
  },
  {
    "id": "sentinel-pintle-choice",
    "unit_id": "ironclad-sentinels",
    "faction_id": "stellar-wardens",
    "model_constraint": {
      "per_n_models": 5,
      "max_count": 1
    },
    "replaces": ["bolt-carbine"],
    "replacement_choice": [
      ["stellar-lance"],
      ["power-halberd", "combat-blade"]
    ],
    "is_free": false,
    "additional_cost": 10,
    "game_version": { "edition": "10th", "dataslate": "2025-q3" }
  }
]
